{
  "$schema": "https://json-schema.org/draft/2020-12/schema",
  "$id": "dtj://schemas/block-manifest.schema.json",
  "title": "Block manifest: the single source of truth for one library block",
  "type": "object",
  "additionalProperties": false,
  "required": [
    "id",
    "title",
    "block_file",
    "placements",
    "licence",
    "slots"
  ],
  "properties": {
    "id": {
      "type": "string",
      "pattern": "^[a-z0-9]+(-[a-z0-9]+)*$"
    },
    "title": {
      "type": "string",
      "minLength": 1
    },
    "block_file": {
      "type": "string",
      "description": "Path of the app block, relative to the library root"
    },
    "placements": {
      "type": "array",
      "minItems": 1,
      "items": {
        "enum": [
          "home",
          "product",
          "collection",
          "cart"
        ]
      }
    },
    "licence": {
      "type": "boolean",
      "description": "Must be true for every proprietary block"
    },
    "slots": {
      "type": "array",
      "description": "Places where brand copy or images go. The installer fills these from the brand config and copy file.",
      "items": {
        "type": "object",
        "additionalProperties": false,
        "required": [
          "id",
          "type",
          "required"
        ],
        "properties": {
          "id": {
            "type": "string"
          },
          "type": {
            "enum": [
              "text",
              "textarea",
              "richtext",
              "inline_richtext",
              "image_picker",
              "url",
              "video",
              "product",
              "product_list"
            ]
          },
          "required": {
            "type": "boolean"
          },
          "max_length": {
            "type": "integer",
            "minimum": 1
          },
          "suggested_fact_keys": {
            "type": "array",
            "items": {
              "type": "string"
            },
            "description": "Hints for brand-config `facts` keys. Never a source of copy by itself."
          }
        }
      }
    },
    "min_filled_slots": {
      "type": "integer",
      "minimum": 1,
      "description": "The block is only added when at least this many required slots have copy"
    },
    "settings": {
      "type": "array",
      "items": {
        "type": "object"
      },
      "description": "Block-specific settings. When present the block file is GENERATED by tools/build_blocks.py (with src/<id>.liquid and src/<id>.css)."
    },
    "standard_controls": {
      "type": "array",
      "items": {
        "enum": [
          "spacing", "spacing_v",
          "gutter",
          "align",
          "colors",
          "shape",
          "text_size"
        ]
      },
      "description": "Standard controls added to every generated block"
    },
    "script": {
      "type": "boolean",
      "description": "The block has src/<id>.js, copied to assets/dtj-<id>.js and loaded through the schema's javascript key"
    },
    "css_includes": {
      "type": "array",
      "items": {
        "type": "string",
        "pattern": "^[a-z0-9-]+$"
      },
      "description": "Shared css fragments src/_<name>.css added to the generated stylesheet"
    },
    "standard_defaults": {
      "type": "object",
      "description": "Per-block defaults for standard controls, for example text_size or padding_top"
    },
    "test": {
      "type": "object",
      "additionalProperties": false,
      "required": [
        "sample",
        "expect"
      ],
      "properties": {
        "sample": {
          "type": "object",
          "description": "Settings that make the block render"
        },
        "product": {
          "type": "object",
          "description": "Optional product object the tests and previews hand to the block (for blocks that read the product)"
        },
        "expect": {
          "type": "array",
          "items": {
            "type": "string"
          },
          "description": "Strings that must appear when licensed and filled"
        }
      }
    },
    "data_needs": {
      "type": "array",
      "items": {
        "type": "string"
      },
      "description": "Metafields or other data the block reads"
    },
    "reference_image": {
      "type": [
        "string",
        "null"
      ]
    }
  }
}
