{
  "id": "whats-not-inside",
  "title": "DTJ Not Inside",
  "block_file": "extensions/dtj-sections/blocks/dtj-whats-not-inside.liquid",
  "placements": [
    "product",
    "home"
  ],
  "licence": true,
  "min_filled_slots": 1,
  "css_includes": [],
  "slots": [
    {
      "id": "heading",
      "type": "text",
      "required": false,
      "max_length": 80
    },
    {
      "id": "highlight_word",
      "type": "text",
      "required": false,
      "max_length": 80
    },
    {
      "id": "subheading",
      "type": "text",
      "required": false,
      "max_length": 80
    },
    {
      "id": "image_1",
      "type": "image_picker",
      "required": false
    },
    {
      "id": "name_1",
      "type": "text",
      "required": true,
      "max_length": 80
    },
    {
      "id": "image_2",
      "type": "image_picker",
      "required": false
    },
    {
      "id": "name_2",
      "type": "text",
      "required": false,
      "max_length": 80
    },
    {
      "id": "image_3",
      "type": "image_picker",
      "required": false
    },
    {
      "id": "name_3",
      "type": "text",
      "required": false,
      "max_length": 80
    },
    {
      "id": "image_4",
      "type": "image_picker",
      "required": false
    },
    {
      "id": "name_4",
      "type": "text",
      "required": false,
      "max_length": 80
    },
    {
      "id": "image_5",
      "type": "image_picker",
      "required": false
    },
    {
      "id": "name_5",
      "type": "text",
      "required": false,
      "max_length": 80
    },
    {
      "id": "image_6",
      "type": "image_picker",
      "required": false
    },
    {
      "id": "name_6",
      "type": "text",
      "required": false,
      "max_length": 80
    },
    {
      "id": "image_7",
      "type": "image_picker",
      "required": false
    },
    {
      "id": "name_7",
      "type": "text",
      "required": false,
      "max_length": 80
    },
    {
      "id": "image_8",
      "type": "image_picker",
      "required": false
    },
    {
      "id": "name_8",
      "type": "text",
      "required": false,
      "max_length": 80
    },
    {
      "id": "image_9",
      "type": "image_picker",
      "required": false
    },
    {
      "id": "name_9",
      "type": "text",
      "required": false,
      "max_length": 80
    },
    {
      "id": "image_10",
      "type": "image_picker",
      "required": false
    },
    {
      "id": "name_10",
      "type": "text",
      "required": false,
      "max_length": 80
    },
    {
      "id": "image_11",
      "type": "image_picker",
      "required": false
    },
    {
      "id": "name_11",
      "type": "text",
      "required": false,
      "max_length": 80
    },
    {
      "id": "image_12",
      "type": "image_picker",
      "required": false
    },
    {
      "id": "name_12",
      "type": "text",
      "required": false,
      "max_length": 80
    }
  ],
  "standard_controls": [
    "spacing",
    "align",
    "colors"
  ],
  "standard_defaults": {
    "padding_top": 24,
    "padding_bottom": 24,
    "align": "center"
  },
  "settings": [
    {
      "type": "text",
      "id": "heading",
      "label": "Heading",
      "info": "Empty = hidden."
    },
    {
      "type": "text",
      "id": "highlight_word",
      "label": "Word with the wavy underline",
      "info": "Type it exactly as it appears in the heading."
    },
    {
      "type": "text",
      "id": "subheading",
      "label": "Subheading",
      "info": "Empty = hidden."
    },
    {
      "type": "select",
      "id": "frame_style",
      "label": "Image frame",
      "default": "none",
      "options": [
        {
          "value": "none",
          "label": "None (image only)"
        },
        {
          "value": "circle",
          "label": "Circle"
        }
      ]
    },
    {
      "type": "checkbox",
      "id": "show_x",
      "label": "Show the cross badge",
      "default": true
    },
    {
      "type": "color",
      "id": "x_color",
      "label": "Cross badge color",
      "info": "Empty = a neutral dark."
    },
    {
      "type": "color",
      "id": "highlight_color",
      "label": "Underlined word color",
      "info": "Empty = same as the text."
    },
    {
      "type": "range",
      "id": "image_size",
      "label": "Image size",
      "min": 60,
      "max": 140,
      "step": 2,
      "unit": "px",
      "default": 92
    },
    {
      "type": "range",
      "id": "heading_size",
      "label": "Heading size",
      "min": 20,
      "max": 48,
      "step": 1,
      "unit": "px",
      "default": 30
    },
    {
      "type": "image_picker",
      "id": "image_1",
      "label": "Item 1 image"
    },
    {
      "type": "text",
      "id": "name_1",
      "label": "Item 1 name",
      "info": "An item only shows when it has a name."
    },
    {
      "type": "image_picker",
      "id": "image_2",
      "label": "Item 2 image"
    },
    {
      "type": "text",
      "id": "name_2",
      "label": "Item 2 name"
    },
    {
      "type": "image_picker",
      "id": "image_3",
      "label": "Item 3 image"
    },
    {
      "type": "text",
      "id": "name_3",
      "label": "Item 3 name"
    },
    {
      "type": "image_picker",
      "id": "image_4",
      "label": "Item 4 image"
    },
    {
      "type": "text",
      "id": "name_4",
      "label": "Item 4 name"
    },
    {
      "type": "image_picker",
      "id": "image_5",
      "label": "Item 5 image"
    },
    {
      "type": "text",
      "id": "name_5",
      "label": "Item 5 name"
    },
    {
      "type": "image_picker",
      "id": "image_6",
      "label": "Item 6 image"
    },
    {
      "type": "text",
      "id": "name_6",
      "label": "Item 6 name"
    },
    {
      "type": "image_picker",
      "id": "image_7",
      "label": "Item 7 image"
    },
    {
      "type": "text",
      "id": "name_7",
      "label": "Item 7 name"
    },
    {
      "type": "image_picker",
      "id": "image_8",
      "label": "Item 8 image"
    },
    {
      "type": "text",
      "id": "name_8",
      "label": "Item 8 name"
    },
    {
      "type": "image_picker",
      "id": "image_9",
      "label": "Item 9 image"
    },
    {
      "type": "text",
      "id": "name_9",
      "label": "Item 9 name"
    },
    {
      "type": "image_picker",
      "id": "image_10",
      "label": "Item 10 image"
    },
    {
      "type": "text",
      "id": "name_10",
      "label": "Item 10 name"
    },
    {
      "type": "image_picker",
      "id": "image_11",
      "label": "Item 11 image"
    },
    {
      "type": "text",
      "id": "name_11",
      "label": "Item 11 name"
    },
    {
      "type": "image_picker",
      "id": "image_12",
      "label": "Item 12 image"
    },
    {
      "type": "text",
      "id": "name_12",
      "label": "Item 12 name"
    }
  ],
  "data_needs": [],
  "reference_image": null,
  "test": {
    "sample": {
      "heading": "What is not inside",
      "highlight_word": "not",
      "subheading": "Sub sample",
      "name_1": "Item One",
      "name_2": "Item Two"
    },
    "expect": [
      "dtj-wni__em",
      "Sub sample",
      "Item One",
      "Item Two",
      "dtj-wni__track"
    ]
  }
}
